,titre,tag_1
1,pudding de noël,dessert
2,verrines de noël,plat principal
3,bûche de noël,dessert
4,bûche de noël au nutella®,dessert
5,boules de noël,confiserie
6,muffins de noël,dessert
7,fondants de noël,confiserie
8,chocolats de noël,confiserie
9,bûche de noël au nutella®,plat principal
10,rôti de noël,plat principal
12,salade de noël,plat principal
13,schabavari de noël,plat principal
14,sapin de noël au nutella®,dessert
15,compote de noël,dessert
18,bûche d'avant noël,dessert
19,pancakes de noël au nutella®,dessert
20,génoise recette de pâtissier,dessert
21,recette de base pour biscuits,dessert
22,butterplätzchen - sablés de noël,entrée
23,sablés exotiques de noël,dessert
24,chapon de noël au lard fumé,plat principal
26,délicieux gâteau de noël,dessert
27,coquille de noël (belgique),dessert
28,petits sablés de noël,confiserie
29,gâteau rond de noël au nutella®,dessert
30,bûche de noël glacée,dessert
31,gâteau de noël périgourdin,dessert
32,pain d'épices de noël,dessert
33,sablés de noël au thermomix,dessert
34,couronne de noël à l’orange et au nutella®,dessert
35,bûche de noël facile,dessert
36,biscuits vitraux de noël,dessert
37,petits biscuits de noël,dessert
38,bûche de noël vialarainne,dessert
39,bûche de noël pomme vanille et nutella®,dessert
40,les bûchettes de noel,confiserie
41,gâteau flocon de noël,dessert
42,biscuits de noël siciliens,dessert
43,gâteau de noël allemand,dessert
44,bonhommes aux épices de noël et au nutella®,dessert
45,biscuits sablés de noël,confiserie
46,bûche de noël au chocolat,dessert
47,bûche de noël de charquemont,dessert
48,rouelle de porc de noël,plat principal
49,mini tatin pommes foie gras de noël par laurent mariotte,entrée
50,bûche de noël excellente !,dessert
52,etoiles glacées de noël,dessert
53,délice de noël au chocolat,dessert
54,salade de pâtes de lentilles corail,plat principal
55,truffe de noël vegan,confiserie
56,pâté en croûte (de noël),entrée
57,kit pour cookies de noël,dessert
59,le steak de renne et sa purée de pommes de terre de juan arbelaez,plat principal
60,chapon farci de noel,plat principal
61,bûche de noël tiramisu,dessert
62,sablés de noël (ausstecherle),confiserie
63,bûche au citron de noël,dessert
64,ricotta de brebis et chips de betterave,entrée
65,bûche de noël de mon enfance,dessert
66,serradura (recette portugaise),dessert
68,chenklish (recette libanaise),entrée
69,rouleau de printemps au confit de canard,plat principal
70,chorba (recette serbe),entrée
71,calentita recette algerienne,entrée
72,yabrack (recette tunisienne),plat principal
73,raclette (recette originale),plat principal
74,purée de butternut et filet de poulet,plat principal
75,cade (recette provençale),entrée
77,patina de poires (recette romaine),dessert
78,paëlla veritable recette de valencia,plat principal
79,croquettes de pommes de terre par laurent mariotte,plat principal
80,la véritable recette de la carbonara,plat principal
81,pâtes gratinées (recettes de famille !!),plat principal
83,"goulash, recette familiale",plat principal
84,salade tiède de pomme de terre et mâche,plat principal
85,bokit (recette guadeloupéenne),plat principal
87,tiramisu (recette originale),dessert
88,chaudeau (recette créole),dessert
89,fricassée de lambi de julien duboué,plat principal
90,"panettone, recette secrète",dessert
91,confiture de melon (recette corse),dessert
92,bûche de noël au pain d'épices,dessert
93,bûche de noël façon elisabeth,dessert
94,viennoise de volaille,plat principal
95,cougnol (spécialité belge de noël),confiserie
96,gâteaux de noël alsacien ou schwowebredele,dessert
97,buche de noël pomme cannelle,dessert
98,brétalas ou bredele de noël (alsace),dessert
99,pastilla de confit de canard par laurent mariotte,plat principal
100,biscuits en pain d'épices de noël,dessert
101,bûche de noël aux spéculoos,dessert
102,bûche de noël à la mangue,dessert
103,cake de noël aux épices,dessert
104,ris de veau,plat principal
105,cougnoux (brioche de noël belge),dessert
106,bûche de noël au chocolat et praliné,dessert
107,bûche de noël chocolat - poires,dessert
108,simple gibier en civet de noël,plat principal
110,la meilleure recette de cookies,dessert
111,millet de courge (recette d'halloween),dessert
112,cannoli (recette sicilienne),dessert
113,kanelbullar (recette suédoise),dessert
114,filet mignon de porc au cidre et dés de lardons,plat principal
115,pancakes : la vraie recette,dessert
116,cannelés bordelais : ma recette de famille,confiserie
117,tortillas (recette sans farine de maïs),plat principal
118,boulettes de poulet (recette minceur),plat principal
119,magrets de canard rôtis au miel et au vinaigre de cidre,plat principal
120,bonhomme de neige : entrée de noël,entrée
121,nougat noir de noël de jacqueline,confiserie
122,bretzels au chocolat (sablés de noël),dessert
123,bûche de noël chocolat / marrons,dessert
124,saumon en croûte de tapenade & tian de légumes rôtis,plat principal
125,bûche de noël au carambars et chocolat,dessert
126,vanocka (gâteau de noël tchèque),dessert
127,bûche aux marrons de noël,dessert
128,bredele (gâteaux de noël alsacien),confiserie
131,petits sablés de noël décorés,confiserie
133,bûche de noël chocolat orange,dessert
134,gratin de coquillettes au potimarron en moins de 30 minutes,plat principal
135,paëlla de valence - recette familiale,plat principal
136,vraie recette du biscuit de savoie,dessert
137,cari de crevettes (recette réunionnaise),plat principal
138,tourte de noël végétarienne de coralie,plat principal
139,crumble aux pommes et beurre de cacahuètes skippy® de@ionalbr,dessert
140,tiramisu de noël (speculoos framboises),dessert
141,pain perdu de noël au chocolat,dessert
142,tiramisù de noël à la clémentine,dessert
143,mesclun de noel au foie gras,entrée
144,curry de pois chiches au beurre de cacahuètes skippy®️,plat principal
145,muffins au potimarron et épices de noël,dessert
146,schwowebredle (petits fours de noël),dessert
147,biscuits de noël aux épices,dessert
148,bûche de noël au chocolat sans gluten,dessert
149,tarte aux oignons et fondue de poireaux de niinii,plat principal
150,la pompe de noël (provence),dessert
151,bûche de noel chocolat passion,dessert
152,"alternative à la ""bûche"" de noël",dessert
153,le boeuf noël de susanne,plat principal
154,crêpes vegan de goodplanet,dessert
155,bûche de noël aux chataignes,dessert
156,tartine du matin de noël (chamallows),dessert
157,bûche rose de noël d'edith,dessert
158,bûche de noël à la vanille,dessert
159,salade de lentilles au crabe,entrée
160,gâteau de noël à la cannelle,dessert
161,biscuits de noël au chocolat (brabanzerl),dessert
162,bûche de noël rapide et pas cher !,dessert
164,"boulettes de veau dans leur pain pita, salade de tomates et concombre",plat principal
165,bûche de noël poire et chocolat,dessert
166,sablés amandine (sablés de noël),confiserie
167,sablés de noël décorés au glaçage,confiserie
168,weihnachtsplätzchen (biscuits de noël allemands),dessert
170,bûche de noël café craquante,dessert
171,petits sablés de noël au citron,dessert
172,les sucettes de noël de géraldine,dessert
173,le fudge (recette anglaise),confiserie
174,salade de reblochon pané,plat principal
175,garantita ou karantita (recette algérienne),plat principal
176,crottes d'âne - recette boulangère,dessert
179,blanquette de veau minute,plat principal
180,bananes meringuées (recette brésilienne),dessert
181,père noël : entrée pour noël,entrée
182,gâteau marbré (recette de grand-mère),dessert
183,baeckehoffe (la meilleure recette de ma grand mère!!),plat principal
185,pudim (recette portugaise authentique),dessert
186,omelette provençale (vieille recette),entrée
187,falafels (recette facile et inratable),plat principal
188,poulet azar (recette tunisienne),plat principal
189,cuisses de poulet à la pâte de curry tikka masala patak's,plat principal
190,panettone (la vraie recette italienne),dessert
193,la tarte au thon de corinne (recette de marseille),plat principal
194,travers de porc printanier,plat principal
195,recette de la pâte a sucre (fondant),dessert
196,chorba algerienne (recette de ma grand-mère),plat principal
197,blancs de poulet noircis (recette cajun),plat principal
198,pasteis de nata (recette à la crème),dessert
200,thon mashuni (recette maldivienne),plat principal
201,chapon noël  farci et accompagné de fruits,plat principal
202,gâteau aux 10 desserts de noël,dessert
203,sablés de noel aux amandes et noisettes,confiserie
205,sablés de noël à la poudre d’amande,dessert
206,bûche de noël façon grand-mère,dessert
207,biscuits de noël aux amandes (alsace),confiserie
208,bûche de noël à la crème au beurre,dessert
209,blanquette de veau au cookeo,plat principal
210,forêt de noël : ravioli aux épinards,plat principal
211,salade d'oranges aux épices de noël,dessert
212,bûche de noël crème pâtissière et chocolat,dessert
214,velouté de butternut et châtaignes,entrée
215,la bûche de noël de mamie popo,dessert
216,bûche de noël crème de marrons chantilly,dessert
217,bûche de noël à la mousse de framboises,dessert
218,bûche de noël au chocolat et gelée de framboise,dessert
219,florentins de laurent mariotte,dessert
220,"chocolats de pâques, de noël ou de tous les jours",confiserie
221,beignets au sucre ( recette marocaine ),dessert
223,véritables flapjacks (recette anglaise),dessert
224,"dos de cabillaud sauce crème, paprika et beurre de cacahuètes skippy®️",plat principal
225,pâtes au chorizo recette simple,plat principal
226,yaourts recette maison (avec yaourtière),dessert
227,la vraie recette de la panna cotta,dessert
228,tarte aux fraise (recette de famille),dessert
229,rillette de maquereau au fromage,entrée
230,bûche de noël aux marrons et au chocolat,dessert
231,bûche de noël chocolat et fruits rouges,dessert
232,"tiramisu de noël (orange, pain d'épices)",dessert
234,nid de pâques au nutella®,dessert
235,petits milanais (biscuits de noël suisse),confiserie
236,gâteau au chocolat (recette américaine),dessert
237,cabri en ragoût - recette corse,plat principal
238,far breton recette authentique,dessert
240,cabri en ragoût - recette corse,plat principal
241,far breton recette authentique,dessert
242,far breton recette traditionnelle,dessert
243,dal bhat (recette népalaise),plat principal
244,curry de légumes aux falafels,plat principal
246,la vraie recette de la galette-comtoise,dessert
247,la recette d'amour de juliette delacroix,entrée
248,emincé de poulet au basilic (recette chinoise),plat principal
249,brownie chocolat au marc de café,dessert
250,jambon de noël,plat principal
251,tiramisù de noël,dessert
252,truffes au chocolat au muesli (pour noël),confiserie
253,bûche noël fruit chocolat,dessert
254,féroce d’avocat de julien duboué,plat principal
255,bûche de noël légère aux marrons,dessert
256,buche de noel à la praline et framboises,dessert
257,"buche traditionnelle de noël, biscuit au marron",dessert
258,bouquettes liégeoises (crêpes belges de noël),confiserie
259,blanquette de saumon romarin au cookeo,plat principal
260,le famous pain d'épices de noël,dessert
261,buche de noël vanille fruits rouges,dessert
262,tarte à l'orange et amandes de noël,dessert
263,petits coeurs ( petits fours de noël ),dessert
264,magret de l’été par laurent mariotte,plat principal
265,biscuits de noël aux noisettes (nüsskipfel),dessert
266,bûche de noël au café - chocolat noisette,dessert
267,biscuits de noël à la confiture vegan,dessert
268,confiture de noël aux fruits secs,confiserie
269,burger de dordogne par laurent mariotte,plat principal
270,bûche de noël à la mousse au chocolat,dessert
271,schokobredle (petits gâteaux de noël au chocolat),dessert
272,verrine de noel aux marrons glacés,dessert
273,tarte de noël aux fruits secs,dessert
274,soupe de lentilles et lardons au cookeo,plat principal
275,petits sablés ( petits fours de noel),dessert
276,couques de noël (délicieux biscuits vanillés),dessert
277,délice de noël aux deux chocolats,dessert
278,patates douces farcies végétariennes de noël,plat principal
279,fajitas de boeuf par laurent mariotte,plat principal
280,bûche de noël aux fruits et mascarpone,dessert
281,sabayon de noël aux marrons glacés,dessert
282,pavlova de noël mangue et fruit de la passion,dessert
283,bottereaux façon mamie noelle,confiserie
285,bûche de noël noix de coco-chocolat,dessert
286,dessert de potiron (kabak tatlisi : recette turque),dessert
287,les nems de ma grand mère (recette originale),entrée
288,lasagne al forno (recette italienne),plat principal
290,pâtes au chou-fleur (recette calabraise),plat principal
291,"penne à la carbonara, recette savoyarde",plat principal
292,linzer torte (la recette alsacienne),dessert
293,boeuf aux oignons (recette grecque),plat principal
294,effiloché de porc par laurent mariotte,plat principal
295,boulettes de boeuf au riz gluant (recette de chine),plat principal
296,gâteau marbré recette de grand-mère au cookeo,dessert
297,salade de crevettes aux pêches (recette légère),entrée
298,boules à la noix de coco (recette algérienne),confiserie
299,courgettes farcies au reblochon de savoie,plat principal
300,cookies de noël aux raisins et à la cannelle,dessert
301,pâte à tartiner de noël pain d'épices,dessert
302,petits gâteaux de noël alsacien au beurre (butterbredle),dessert
303,la tartignole (recette typique du nord),dessert
304,macarons au fruit de la passion et au nutella®,dessert
305,pain d'épices (recette du moyen-age),dessert
306,spaghettis carbonara : la recette italienne sans crème !,plat principal
307,tourte aux herbes (recette corse),entrée
308,porc au caramel recette chinoise facile,plat principal
309,cheesecake de dordogne par laurent mariotte,dessert
310,"gâteau pomme-cannelle, ambiance noël",dessert
311,gâteau marbré recette de grand-mère au companion,dessert
312,"beignets de prunes (szilvas gomboc, recette hongroise)",dessert
313,choux farcis (recette polonaise que je tiens de ma mamie),plat principal
314,cookie vegan de ela ryth,dessert
315,"gâteau pomme-cannelle, ambiance noël",dessert
316,riz de noël,dessert
317,tajine de noël,plat principal
318,recette baba chantilly par jeffrey cagnes,dessert
319,salade de pâtes au reblochon et au pesto,plat principal
320,"poulpe ""a lagareiro"" (recette portugaise)",plat principal
321,spaghetti au thon (véritable recette italienne),plat principal
322,crème pâtissière recette d'un pâtissier,dessert
323,scampis à l'italienne (recette maison),entrée
324,kadaif de langoustines et bisque maison,entrée
325,véritable carrot cake (recette usa),dessert
326,nems au crabe - recette vietnamienne + sauce,entrée
327,pompe de noël,dessert
328,petits gâteaux de noël de mémé ou bredele de mémé,dessert
329,risotto à la saucisse de veau,plat principal
330,blinis à la farine de châtaignes (recette corse),dessert
